	Yes	Switcheo	A a decentralised exchange based in Singapore. ZilSwap was built in collaboration with Switcheo.	yes		DeFi	Live	https://twitter.com/SwitcheoLabs	https://switcheo.network/	https://discord.com/invite/SPh62Hf	https://t.me/switcheo
		Ten31	Connecting the dots between DeFi and banking.			Defi	Live	https://twitter.com/TEN31Bank	https://www.ten31.com/	NA	NA
		TokoCrypto	An Indonesian crypto exchange for learning, buying, selling and investing in crypto safely.	yes		Exchange	Live	https://twitter.com/TokoCrypto	https://www.tokocrypto.com/	NA	https://t.me/TokocryptoOfficial
		Torus	An open-source key management system that is simple, secure and non-custodial.	no		API	Live	https://twitter.com/TorusLabs	https://tor.us/	https://github.com/torusresearch/	https://t.me/TorusLabs
	Yes	Transak	A crypto onboarding platform for users to transact between fiat and crypto assets easily with just a bank transfer.	yes		Exchange	Live	https://twitter.com/transak_finance	https://transak.com/	https://discord.gg/KeT6QZV	https://t.me/transakfinance
		Travala	Travala is a travel booking website that accepts payment in various cryptocurrencies, including Zilliqa.			App	Live	https://twitter.com/travalacom	https://www.travala.com/payment/zilliqa-zil	NA	NA
		Tribe	A product-focused accelerator aimed at finding great companies with innovative blockchain use cases.	yes		Education	Live	NA	https://tribex.co/	NA	NA
	Yes	Trust Wallet	A secure software wallet that allows its users to store their BEP2, ERC20 and ERC721 tokens.	yes		Wallet, App	Live	https://twitter.com/trustwalletapp	https://trustwallet.com/	NA	https://t.me/trust_announcements
		Ultimate Franchise Fantasy Sports (UFF Sports)	The world’s first fantasy sports ecosystem offering ownership of franchises and players as digital NFTs on the Zilliqa blockchain.	yes		Gaming, Dapp	Live	https://twitter.com/uffsports	https://uffsports.com/	NA	https://t.me/joinchat/Go5RhA8PS6j5DKvzXjXGmw
		Unblock Analysis	Unblock uses real time KYC to enable easy compliance and deep insights into every transaction, helping users make more-informed decisions.	no		API	Live	NA	https://www.unblock-analysis.com/	NA	NA
		Unicutes	A verifiable random number generated digital art collection with a limited supply of 9999.	no		NFT, Dapp	Live	https://twitter.com/unicutes?lang=en	NA	NA	NA
	Yes	unMineable	unMineable provides a seamless experience for miners for non-mineable crypto coins.	yes		Mining	Live	https://twitter.com/un_mineable	https://unmineable.com/coins/ZIL	NA	NA
yes	yes	Unstoppable Domains	Application which a users to replace their crypto wallet addresses with readable domain names.	yes		Domains	Live	https://twitter.com/unstoppableweb	https://unstoppabledomains.com/	NA	NA
	Yes	Upbit	A South Korean cryptocurrency exchange that allows for trading of various altcoins and Bitcoin.	yes		Exchange	Live	https://twitter.com/upbitglobal	upbit.com/home	NA	NA
	Yes	Uphold Wallet	A multi-asset trading platform and wallet that enables trading and swapping of anything from US equities to precious metals to cryptocurrencies.	yes		Wallet, Exchange	Live	https://twitter.com/UpholdInc	https://uphold.com/en-us	NA	NA
		Valkyrie	A specialized alternative asset management firm at the intersection of traditional finance and the emerging cryptocurrency sector. 			NA	NA	NA	NA	NA	NA
		Viewbase	A digital assets analytics tool with data for analysing exchange wallets, futures, options and margins.	yes		API, Explorer	Live	NA	https://www.viewbase.com/	NA	NA
	Yes	Viewblock	An early ecosystem grantee which built Zilliqa's blockchain explorer.	yes		API	Live	https://twitter.com/view_block	https://viewblock.io/	NA	NA
		WAFU	The official account for $Wafu Token. Buy, Sell, Trade and Auction Waifu Trading Cards			NFT	Building	https://twitter.com/wafutoken	NA	NA	NA
		WazirX	India's most trusted Bitcoin and cryptocurrency exchange platform.	yes		Exchange	Live	https://twitter.com/WazirxIndia	https://wazirx.com/	NA	https://t.me/wazirx
		Wintermute	An expert in market making, dedicated to helping digital asset exchanges and blockchain project founders build the future of finance.	No		Custody	Live	https://twitter.com/wintermute_t	https://www.wintermute.com/	NA	NA
	Yes	Xanpool	An internationally compliant fiat-gateway software solution for exchanges, wallets, and other cryptocurrency businesses. 	Yes		Exchange	Live	@XanpoolOfficial	https://xanpool.com/	NA	https://t.me/joinchat/FF2GFRQMgdtBxq67hc3UZw
		XCAD Network	A platform harnessing the value of content consumers via tokenisation, via which viewers earn rewards used for fan governance. 	Yes		Dapp, App, NFT, DEX, Metaverse	Live	https://twitter.com/xcademyofficial?lang=cs	https://www.xcademy.com/	NA	NA
	Yes	Xfers	A payment solutions provider for businesses, licensed by the Monetary Authority of Singapore.	Yes		Payment	Live	https://twitter.com/xfers	https://www.xfers.com/sg	NA	NA
		Chocolate Stablecoin		Yes		Stablecoin, Defi	Live		https://mambo.li/stablecoins/franc/		
		HODL		Yes		Meme Token	Live		https://zilstream.com/tokens/hodl		https://t.me/thehodltoken
		DogZilliqa		Yes		Meme Token	Live		https://godzilliqadefi.medium.com/dogzilliqa-token-9141f33beba5		
		Flat Lazy Ass Token		Yes		Meme Token	Live		https://zilstream.com/tokens/flat		https://t.me/Flattoken
		Zeeves	Zeeves is Zilliqa's peer-to-peer reward and engagement bot made for users on Telegram.	Yes		Wallet	Live	@ZeevesBot	https://zeeves.io/	NA	https://t.me/zilliqawalletbot
		ZenGo	A crypto wallet that allows its users to send crypto freely with no maximum or minimum amounts and no extra fees. ZenGo is a keyless crypto wallet, using facial biometrics to secure the wallet.	yes		Wallet	Live	https://twitter.com/zengo	https://zengo.com/	NA	NA
		Zeydra	A matchmaking platform using crypto interactions.	No		App, dApp	Building	NA	https://zeydra.com/	NA	NA
		zil-cli	Command Line Interface for Zilliqa Blockchain.	yes		SDK, Tools	Live	NA	https://zilcli.app/#/	NA	NA
		ZilChess	A decentralised chess platform running on the Zilliqa blockchain.	Yes		Gaming	Live	https://twitter.com/zilchess	https://www.zilchess.com/	NA	NA
		ZilChill	Decentralizing the Gaming Industry on Zilliqa			Gaming	Live	NA	https://zilchill.com/	NA	NA
		Duck	The first hard cap bonding curve art collection on Zilliqa with a max supply of 8192.	Yes		NFT, Dapp	Live	https://twitter.com/zilduck?lang=en	https://duck.community	NA	NA
		Yoda	Decentralizing E-commerce. The store with all of your favourite ZRC-2 token branded merch.			App, dApp	Live	https://twitter.com/jody96718451?lang=en	https://yodamerch.co.za/	NA	https://t.me/Yodaco
		zilFlip	Fantasy themed dividend games running on the Zilliqa blockchain.	Yes		Gaming	Live	https://twitter.com/ZilFlip	https://zilflip.com/	NA	NA
		Zilgraph	An open source dashboard for visualising ZilSwap activity on the Zilliqa blockchain.	Yes		Tools	Live	https://twitter.com/zilgraph	https://zilgraph.io/zilswap	NA	NA
	Yes	ZilHive	ZILHive is Zilliqa's ecosystem growth arm committed in supporting the growth of all projects built on Zilliqa.	Yes		Fund	Live	https://twitter.com/zilhive	https://zilhive.org/	NA	NA
		ZilLab Explorer	ZilLab Explorer is a Blockchain Explorer and Analytics Platform for Zilliqa.			Explorer	Live	NA	https://zillab.com/	NA	NA
	Yes	Zillet	An open-source, client-side wallet for interacting with the Zilliqa blockchain.	Yes		Wallet, Web3, Defi, staking	Live	https://twitter.com/zilletio	https://zillet.io/	NA	NA
		Zillion	A simplified, user-friendly staking portal where users can earn APY for staking their ZIL via various supporting seed nodes.	Yes		Staking	Live	NA	https://stake.zilliqa.com/	NA	NA
		Zilliqa Capital	An investment vehicle that invests in next-generation blockchain solutions built on Zilliqa.	Yes		Fund	Live	https://twitter.com/zilliqacapital	https://zilliqacapital.com/	NA	NA
		Zilliqa Royale	Play the first blockchain powered battle royale game running on Minecraft!			App, gaming, NFT	Live	NA	https://zilliqaroyale.com/	NA	https://t.me/zilliqaroyale_discussion
		Zilon	A payment service that allows merchants and users to accept ZIL as a payment.	No		Payment	Live	https://twitter.com/Zilonofficial	https://www.zilon.io/	NA	NA
		Zilo	ZilSwap Initial Launch Offering (ZILO) is a platform where ZWAP holders can participate in new token launches.	Yes		Infra	Live	NA	https://zilswap.io/zilo/current	NA	NA
	Yes	ZilPay	A browser-based wallet extension for Zilliqa.	yes		Wallet, Web3, Defi, staking	Live	https://twitter.com/pay_zil	https://zilpay.xyz/	NA	https://t.me/zilpay
	Yes	ZilStars	Exclusive NFT collectibles, curated and commissioned by global football titans for their beloved fans.	yes		NA	Live	NA	https://football.zilstars.com/	NA	NA
	Yes	ZILStream	ZILStream provides data for ZRC-2 ecosystem tokens and your ZRC-2 portfolio.	yes		Dapp, Tools	Live	https://twitter.com/zilstream	https://zilstream.com/	NA	NA
		Zilsurvey	Help researchers by sharing your opinion. Getting solid feedback is critical for building a good product, help developers by filling in surveys.			NA	Live	NA	https://www.zilsurvey.com/	NA	NA
	Yes	Zilswap	The premier DEX on the Zilliqa blockchain.	yes		DEX	Live	NA	https://zilswap.io/	NA	NA
		ZILWall	A creative collaboration pixel art project where communities can collaborate on canvases to create their own art.	yes		NFT, Dapp	Live	https://twitter.com/zwall_zpaint?lang=en	https://zilwall.com/	NA	NA
		ZILWatch	A smart dashboard for you to track prices of ZRC-2 tokens.	yes		Dapp, Tools	Live	https://twitter.com/zilWatch_io	https://zilwatch.io/	NA	NA
	Yes	Zyro	Protocol for automated liquidity built on Zilliqa.	yes		DeFi	Live	https://twitter.com/zyro_finance	https://zyro.finance/	NA	NA